{
  "schema_version": "retrieval_annotation_record_v1",
  "annotation_id": "ann.fixture.answerable.final",
  "dataset_version": "fixture-v1",
  "question_id": "fixture.formal.answerable",
  "role": "ADJUDICATOR",
  "annotator_id": "adjudicator_fixture",
  "submitted_at": "2026-07-21T09:10:00+08:00",
  "answerability": "ANSWERABLE",
  "expected_route": "HYBRID_QA",
  "chunk_judgments": [
    {
      "chunk_id": "chunk_fixture_001",
      "document_id": "doc_fixture_001",
      "page_start": 5,
      "page_end": 5,
      "relevance": 3,
      "supports_claims": ["claim_fixture_001"]
    }
  ],
  "notes": "Adjudicated public fixture label.",
  "based_on_annotation_ids": [
    "ann.fixture.answerable.a",
    "ann.fixture.answerable.b"
  ]
}
